{"effects":{"classifications":[],"containsDestructive":false,"containsUnknown":false,"executionAuthorityGranted":false},"importId":"mcp:aspire-agent-mcp:8cbd14c8fadd","kind":"capability.import","prompts":[],"provenance":{"importer":"pmcro-capability-import/mcp","snapshotImmutable":true,"snapshotSha256":"8cbd14c8faddb94ab8a66ea7562062e6b441e17880bfc39f5c00ad905c57c1b8"},"resources":[],"schemaVersion":1,"schemas":[],"skillProjection":{"registrationRequiresIndependentCheck":true,"requiredCore":["SKILL.md","agents/"],"reuseByAdapter":true,"scriptsRequired":false,"suggestedLayers":["assets"],"target":{"plugin":"aspire","skill":"aspire-agent-mcp"}},"source":{"description":"Plan or explicitly launch the Aspire agent MCP server with caller-supplied dashboard settings. Dry-run by default; never discovers credentials.","nativeId":"aspire-agent-mcp","nativeVersion":null,"sourceRef":"github://pmcr-o/aspire-agent@95cda7cca4fa2c47f66331bcbe4c07d44d8c1502/.pmcro/plugins/aspire/skills/agent-mcp","type":"mcp"},"status":"generated-unchecked","tools":[],"transport":{"argsRef":null,"authRef":null,"binding":"stdio","commandRef":"github://pmcr-o/aspire-agent@95cda7cca4fa2c47f66331bcbe4c07d44d8c1502/.pmcro/plugins/aspire/skills/agent-mcp/scripts/operate.ps1","endpointRef":null,"protocol":"mcp","protocolVersion":null,"secretMaterialIncluded":false}}
